<?xml version="1.0" encoding="UTF-8"?>
<platforms xmlns="http://composestar.sourceforge.net/schema/PlatformConfiguration"
	xmlns:xsi="http://www.w3.org/2001/XMLSchema-instance"
	xsi:schemaLocation="http://composestar.sourceforge.net/schema/PlatformConfiguration ../../ComposestarCORE/src/Composestar/Core/Config/Xml/PlatformConfiguration.xsd ">
	<platform id="CwC">
		<languages>
			<language name="C">
				<extensions>
					<extension>c</extension>
				</extensions>
				<compiler class="Composestar.CwC.COMP.CCompiler">
					<action name="preprocess" executable="gcc">
						<arg>-E</arg><!-- only preprocess -->
						<arg>-dD</arg><!-- keep macros -->
						<arg>-C</arg><!-- preserve comments, they contain the annotations -->
						<arg>-I</arg>
						<arg>${includedir}</arg>
						<list var="defines" split=";">
							<arg>-D${ENTRY}</arg>
						</list>
						<arg>-o</arg>
						<arg>${OUT}</arg>
						<sources>
							<arg>${SOURCE}</arg>
						</sources>
					</action>
					<action name="compile" executable="gcc">
						<arg>-I</arg>
						<arg>${includedir}</arg>
						<arg>-include</arg>
						<arg>JoinPointContext.h</arg>
						<arg>-o</arg>
						<arg>${OUT}</arg>
						<arg>${SOURCE}</arg>
					</action>
				</compiler>
				<!-- <dummygenerator>...</dummygenerator>  -->
			</language>
		</languages>
		<resources>
			<file>file</file>
		</resources>
	</platform>
</platforms>
